{
  "$schema": "https://json-schema.org/draft/2020-12/schema",
  "title": "Collateral Set",
  "type": "object",
  "required": ["collateral_set_id", "as_of", "currency"],
  "properties": {
    "collateral_set_id": {"type": "string"},
    "as_of": {"type": "string"},
    "currency": {"type": "string"},
    "market_value": {"type": "number"},
    "haircut": {"type": "number"},
    "eligible_value": {"type": "number"},
    "assets": {"type": "array"},
    "attributes": {"type": "object"}
  }
}
